{
  "$schema": "../data-models/specification-phase.schema.json",
  "schemaVersion": "1.0.0",
  "specificationVersion": "0.4.0",
  "phase": "qualification-3a",
  "productionReady": false,
  "permittedStage4Scopes": ["qualification"],
  "requiredSuccessor": "production-3b",
  "blockers": [
    "substrate-selection",
    "common-layout-visit-cap",
    "complete-tier-1-qualification",
    "qualification-lock-not-candidate-implementation-ready",
    "qualification-lock-not-measurement-ready"
  ],
  "candidateStates": {
    "focused": "trial",
    "integrated": "trial"
  },
  "requiredProductionVersion": ">=1.0.0"
}
