{
  "schemaVersion": "1.0.0",
  "specificationVersion": "1.0.0",
  "phase": "production-3b",
  "productionReady": true,
  "permittedStage4Scopes": [
    "qualification",
    "production"
  ],
  "requiredSuccessor": "none",
  "blockers": [],
  "candidateStates": {
    "focused": "selected",
    "integrated": "removed"
  },
  "requiredProductionVersion": ">=1.0.0",
  "promotionEvidence": {
    "qualificationLockDigest": "8b86f7ee0b8f6a02605158969230d2621159512b1eef917a184618863287f582",
    "selectedCandidate": "focused",
    "selectionDecision": {
      "path": "evidence/selection-decision.json",
      "sha256": "a93dd1d089317d947a9826dcbcd663a8310e43ca508fcaebb99efd66434f7b1e"
    },
    "selectedCandidateQualification": {
      "path": "evidence/selected-qualification.json",
      "sha256": "aeb2745597b13bce82a1bf60417e85d47afa43d71397cb44f1da09423c2d41d2"
    },
    "layoutQualification": {
      "path": "evidence/layoutQualification.txt",
      "sha256": "14fd383035a3791b1d0c0b65cf32157bc2ce2e07ee88398f4fc1eb2fac0d4f8f"
    },
    "acceptedAdr0010": {
      "path": ".constitution/tech-spec/adrs/ADR-0010-production-substrate.md",
      "sha256": "def9c6dc6c04476562b15fb7ff6e3cfcdc1486fa1e05c7df121db553ec10b136"
    },
    "finalContractSet": {
      "path": "evidence/finalContractSet.txt",
      "sha256": "80438aa1cd1f9bd86aa58ad95db6ec4dd140afd4ba7c3bfa37c9495a33bfaffd"
    },
    "targetMatrix": {
      "path": "evidence/targetMatrix.txt",
      "sha256": "19acde8d87d03436fb5c0e5caaa70e3e31a812ce1e35d456dd929e678f52f1de"
    },
    "allTier1Results": {
      "path": "evidence/all-tier1-results.json",
      "sha256": "aeb2745597b13bce82a1bf60417e85d47afa43d71397cb44f1da09423c2d41d2"
    },
    "losingCandidateRemoval": {
      "path": "evidence/losingCandidateRemoval.txt",
      "sha256": "eda84e96dfa02bc73aa1e974b8bef8c2c82950ccb70979233e4a7bb24b5d328b"
    },
    "billOfMaterials": {
      "path": "evidence/billOfMaterials.txt",
      "sha256": "89957b758c2e9dca76a0d667256733af8f26fec1f2561499f4ff602cfe1d926d"
    },
    "releaseQualification": {
      "path": "evidence/release-qualification.json",
      "sha256": "c3a1469acc6626addacfb8fd0f022adc50d60e8e1964f597f43bd137fd453d6b"
    }
  }
}
