{"$schema":"../../../.constitution/tech-spec/data-models/specification-phase.schema.json","blockers":["evidence-fixture"],"candidateStates":{"focused":"trial","integrated":"trial"},"permittedStage4Scopes":["qualification"],"phase":"qualification-3a","productionReady":false,"requiredProductionVersion":">=1.0.0","requiredSuccessor":"production-3b","schemaVersion":"1.0.0","specificationVersion":"0.15.0"}
